{
  "schema_version": "1.0",
  "type": "design",
  "id": "d-2",
  "record": {
    "schema_version": "1.0",
    "id": "design-000042",
    "seed": 42,
    "mode": "design",
    "stack": {
      "outer_oz": 2,
      "inner_oz": 1,
      "k_fr4_xy": 0.95
    },
    "layers": [
      {
        "layer": 1,
        "shapes": [
          {
            "type": "rect",
            "x0": 5,
            "y0": 60,
            "w": 10,
            "h": 20
          },
          {
            "type": "rect",
            "x0": 19,
            "y0": 60,
            "w": 10,
            "h": 20
          },
          {
            "type": "rect",
            "x0": 33,
            "y0": 60,
            "w": 10,
            "h": 20
          },
          {
            "type": "rect",
            "x0": 47,
            "y0": 60,
            "w": 10,
            "h": 20
          },
          {
            "type": "rect",
            "x0": 61,
            "y0": 60,
            "w": 10,
            "h": 20
          },
          {
            "type": "rect",
            "x0": 75,
            "y0": 60,
            "w": 10,
            "h": 20
          }
        ]
      },
      {
        "layer": 2,
        "plane": true,
        "cutouts": []
      },
      {
        "layer": 3,
        "split_rects": [
          {
            "type": "rect",
            "x0": 0,
            "y0": 0,
            "w": 100,
            "h": 40
          },
          {
            "type": "rect",
            "x0": 0,
            "y0": 40,
            "w": 60,
            "h": 60
          },
          {
            "type": "rect",
            "x0": 60,
            "y0": 40,
            "w": 40,
            "h": 60
          }
        ]
      },
      {
        "layer": 4,
        "shapes": []
      }
    ],
    "chips": [
      {
        "x0": 10,
        "y0": 10,
        "w": 8,
        "h": 8,
        "P": 0.5,
        "side": "top"
      },
      {
        "x0": 30,
        "y0": 10,
        "w": 12,
        "h": 6,
        "P": 2.0,
        "side": "top"
      },
      {
        "x0": 60,
        "y0": 15,
        "w": 6,
        "h": 6,
        "P": 0.1,
        "side": "top"
      },
      {
        "x0": 80,
        "y0": 30,
        "w": 10,
        "h": 10,
        "P": 3.0,
        "side": "top"
      }
    ],
    "via_arrays": [
      {
        "x0": 10,
        "y0": 10,
        "w": 8,
        "h": 8,
        "density_per_mm2": 0.2
      },
      {
        "x0": 80,
        "y0": 30,
        "w": 10,
        "h": 10,
        "density_per_mm2": 1.0
      }
    ],
    "background_via_density_per_mm2": 0.0,
    "convection": {
      "h_top": 5.0,
      "h_bot": 15.0,
      "forced_zone": {
        "x0": 50,
        "y0": 0,
        "w": 50,
        "h": 60,
        "h_top": 40.0
      }
    },
    "dirichlet_edges": [],
    "design_vector": [
      0.0125,
      0.0375,
      0.0625,
      0.0875,
      0.1125,
      0.1375,
      0.1625,
      0.1875,
      0.2125,
      0.2375,
      0.2625,
      0.2875,
      0.3125,
      0.3375,
      0.3625,
      0.3875,
      0.4125,
      0.4375,
      0.4625,
      0.4875,
      0.5125,
      0.5375,
      0.5625,
      0.5875,
      0.6125,
      0.6375,
      0.6625,
      0.6875,
      0.7125,
      0.7375,
      0.7625,
      0.7875,
      0.8125,
      0.8375,
      0.8625,
      0.8875
    ]
  }
}
